{
  "id": "path_10-12_cyber_digital_citizenship",
  "title": "Digital Citizenship and Online Safety (Ages 10-12)",
  "age_group": "10-12",
  "domain": "cyber",
  "description": "A pathway that equips parents with tools to protect their children in the digital world: privacy, cyberbullying, screen addiction, critical thinking about content, while respecting their privacy.",
  "lesson_ids": [
    "lesson_10-12_cyber_digital_citizenship_01",
    "lesson_10-12_cyber_digital_citizenship_02",
    "lesson_10-12_cyber_digital_citizenship_03",
    "lesson_10-12_cyber_digital_citizenship_b04"
  ],
  "estimated_days": 4,
  "pedagogical_framework": "zpd_scaffolded",
  "primary_reference": {
    "type": "دليل_تربوي",
    "info": "UNICEF guidance on digital citizenship for children"
  },
  "prerequisites": [],
  "is_published": true,
  "version": "1.0.0",
  "updated_at": "2026-06-13T00:00:00",
  "approved_by": "auto-review:deepseek-v4-pro+glm-5.2:2026-10-04",
  "language": "en",
  "source_language": "ar",
  "translation": {
    "translator_model": "mistral-large-3:675b",
    "reviewer_model": "deepseek-v4-pro+glm-5.2",
    "needs_scholar_review": true,
    "scholar_signals": {
      "keyword": false,
      "quoted_arabic": true,
      "reviewer_model": false
    },
    "review_verdict": "clean",
    "review_defects": [],
    "approved_by": "auto-review:deepseek-v4-pro+glm-5.2:2026-10-04",
    "revalidated_at": "2026-10-04T11:18:18+00:00",
    "auto_review": {
      "reviewers": [
        "deepseek-v4-pro",
        "glm-5.2"
      ],
      "fixer": null,
      "rounds": 1,
      "prompt_version": "dfa8a5f39718",
      "content_sha256": "28065014eb5565d0bbf78be483dd6f63a89c6fbe8dcc9f3cb4e906a19b9dfc7d",
      "reviewed_at": "2026-10-04T11:18:18+00:00",
      "residual_low": [],
      "adjudicated": [],
      "tool": "ops/tools/review_en_parity.py",
      "meaning": "deterministic guards passed and two different-family model reviewers found no medium/high defect in this exact text; not a scholar's ijazah"
    }
  }
}
