{
  "id": "path_16-18_medical_adult_transition",
  "title": "Mental Health of the Young Adult: Independence, Stability, and Seeking Help (16-18 Years)",
  "age_group": "16-18",
  "domain": "medical",
  "description": "A pathway for the older adolescent preparing for legal adulthood: maintaining mental health in university/work, managing the pressures of independence, recognizing warning signs, and building a sustainable support network.",
  "lesson_ids": [
    "lesson_16-18_medical_adult_transition_01",
    "lesson_16-18_medical_adult_transition_02",
    "lesson_16-18_medical_adult_transition_03",
    "lesson_16-18_medical_adult_transition_b04"
  ],
  "estimated_days": 12,
  "pedagogical_framework": "attachment_rahma",
  "primary_reference": {
    "type": "دليل_طبي",
    "info": "APA guide to the transition to adulthood + youth mental health guidelines"
  },
  "prerequisites": [],
  "is_published": true,
  "version": "1.0.0",
  "updated_at": "2026-06-13T00:00:00",
  "approved_by": "auto-review:deepseek-v4-pro+glm-5.2:2026-10-04",
  "language": "en",
  "source_language": "ar",
  "translation": {
    "translator_model": "mistral-large-3:675b",
    "reviewer_model": "deepseek-v4-pro+glm-5.2",
    "needs_scholar_review": true,
    "scholar_signals": {
      "keyword": false,
      "quoted_arabic": true,
      "reviewer_model": false
    },
    "review_verdict": "clean",
    "review_defects": [],
    "approved_by": "auto-review:deepseek-v4-pro+glm-5.2:2026-10-04",
    "revalidated_at": "2026-10-04T11:18:19+00:00",
    "fixed_at": "2026-08-13T19:07:12.819265+00:00",
    "fixer_model": "mistral-large-3:675b",
    "auto_review": {
      "reviewers": [
        "deepseek-v4-pro",
        "glm-5.2"
      ],
      "fixer": null,
      "rounds": 1,
      "prompt_version": "dfa8a5f39718",
      "content_sha256": "a3d225fb891f5717aa05be105cdd2954b1cb661440c99cb330b2167bc1e64b4e",
      "reviewed_at": "2026-10-04T11:18:19+00:00",
      "residual_low": [],
      "adjudicated": [],
      "tool": "ops/tools/review_en_parity.py",
      "meaning": "deterministic guards passed and two different-family model reviewers found no medium/high defect in this exact text; not a scholar's ijazah"
    }
  }
}
