{
  "id": "path_prenatal-1_infant_pregnancy_foundations",
  "title": "الحمل والمولود الجديد: رحلة الرعاية والسكينة",
  "age_group": "prenatal-1",
  "domain": "infant_pregnancy",
  "description": "مسار شامل يرافق الأمهات والآباء الجدد من أواخر الحمل وحتى الأشهر الأولى للمولود: الدعم النفسي والارتباط المبكر بالجنين وسماعه للقرآن، سنن الاستقبال النبوية، إتقان الرضاعة الطبيعية، فك شفرة البكاء والنوم الآمن، وحظر الشاشات وصحة الوالدين النفسية.",
  "lesson_ids": [
    "lesson_prenatal-1_infant_pregnancy_01",
    "lesson_prenatal-1_infant_pregnancy_02",
    "lesson_prenatal-1_infant_pregnancy_03",
    "lesson_prenatal-1_infant_pregnancy_04",
    "lesson_prenatal-1_infant_pregnancy_05"
  ],
  "estimated_days": 5,
  "pedagogical_framework": "attachment_rahma",
  "primary_reference": {
    "type": "دليل_طبي",
    "info": "AAP Safe Sleep & Infant Care Guidelines + تحفة المودود بأحكام المولود لابن القيم"
  },
  "prerequisites": [],
  "is_published": true,
  "version": "1.0.0",
  "created_at": "2026-09-12T19:00:00",
  "updated_at": "2026-09-12T19:00:00",
  "approved_by": null
}
