{
  "id": "path_16-18_islamic_parenting_adult_faith",
  "title": "Toward Independent Imani Growth: Accompanying Your Young Adult at Life’s Threshold (16-18 Years)",
  "age_group": "16-18",
  "domain": "islamic_parenting",
  "description": "A pathway to help parents guide their child from inherited iman to firmly rooted conviction, while preparing for marriage and upholding `iffah (chastity) through open dialogue. It focuses on crafting a life mission that connects ambition with purpose, and independence with decision-making and responsibility—before leaving home.",
  "lesson_ids": [
    "lesson_16-18_islamic_parenting_adult_faith_02",
    "lesson_16-18_islamic_parenting_adult_faith_04"
  ],
  "estimated_days": 2,
  "pedagogical_framework": "prophetic_7_7_7",
  "primary_reference": {
    "type": "كتاب_تربوي",
    "info": "Tarbiyat al-Awlad fi al-Islam (Raising Children in Islam) by Abdullah Nasih Ulwan + Manhaj al-Tarbiyah al-Nabawiyyah lil-Tifl (The Prophetic Method of Raising the Child) by Muhammad Nur Suwayd"
  },
  "prerequisites": [],
  "is_published": true,
  "version": "1.0.0",
  "approved_by": "auto-review:deepseek-v4-pro+glm-5.2:2026-10-04",
  "language": "en",
  "source_language": "ar",
  "translation": {
    "translator_model": "mistral-large-3:675b",
    "reviewer_model": "deepseek-v4-pro+glm-5.2",
    "needs_scholar_review": true,
    "scholar_signals": {
      "keyword": false,
      "quoted_arabic": true,
      "reviewer_model": false
    },
    "review_verdict": "low_only",
    "review_defects": [
      {
        "model": "deepseek-v4-pro",
        "field": "description",
        "type": "meaning",
        "why": "The Arabic says 'their son' (ابنهم) but the English neutralizes it to 'their child'."
      },
      {
        "model": "glm-5.2",
        "field": "description",
        "type": "meaning",
        "why": "The Arabic says 'firmly rooted iman with conviction' (إيمانٍ راسخٍ بقناعة), but the English drops 'iman' at the end, reducing it to 'conviction' alone."
      }
    ],
    "approved_by": "auto-review:deepseek-v4-pro+glm-5.2:2026-10-04",
    "revalidated_at": "2026-10-04T11:18:19+00:00",
    "auto_review": {
      "reviewers": [
        "deepseek-v4-pro",
        "glm-5.2"
      ],
      "fixer": null,
      "rounds": 1,
      "prompt_version": "dfa8a5f39718",
      "content_sha256": "51e6385be11b1ca93e59c17458e8bd2bcd5eb5078299d62afe0d7d5ef8f56bc2",
      "reviewed_at": "2026-10-04T11:18:19+00:00",
      "residual_low": [
        {
          "model": "deepseek-v4-pro",
          "field": "description",
          "type": "meaning",
          "why": "The Arabic says 'their son' (ابنهم) but the English neutralizes it to 'their child'."
        },
        {
          "model": "glm-5.2",
          "field": "description",
          "type": "meaning",
          "why": "The Arabic says 'firmly rooted iman with conviction' (إيمانٍ راسخٍ بقناعة), but the English drops 'iman' at the end, reducing it to 'conviction' alone."
        }
      ],
      "adjudicated": [],
      "tool": "ops/tools/review_en_parity.py",
      "meaning": "deterministic guards passed and two different-family model reviewers found no medium/high defect in this exact text; not a scholar's ijazah"
    }
  }
}
