{
  "id": "path_13-15_islamic_parenting_teen_identity",
  "title": "بناء الهوية الإسلامية للمراهق: بين الشك واليقين (13-15 سنة)",
  "age_group": "13-15",
  "domain": "islamic_parenting",
  "description": "مسار يساعد الوالدين على مرافقة ابنهم المراهق في رحلة بناء هويته الإسلامية: مواجهة الشبهات، فهم العبادات بعمق، الاستعداد للزواج، وصناعة قرار مستقل.",
  "lesson_ids": [
    "lesson_13-15_islamic_parenting_teen_identity_02",
    "lesson_13-15_islamic_parenting_teen_identity_03",
    "lesson_13-15_islamic_parenting_teen_identity_04"
  ],
  "estimated_days": 3,
  "pedagogical_framework": "prophetic_7_7_7",
  "primary_reference": {
    "type": "كتاب_تربوي",
    "info": "تربية الأولاد في الإسلام لعبد الله ناصح علوان + فقه النفس للقرني"
  },
  "prerequisites": [],
  "is_published": true,
  "version": "1.0.0",
  "approved_by": null
}
