{
  "id": "path_4-6_development_positive_parenting",
  "title": "التربية الإيجابية والأمان: بناء ثقة الطفل (4-6 سنوات)",
  "age_group": "4-6",
  "domain": "development",
  "description": "رحلة تربوية لبناء ثقة الطفل بنفسه وأمانه الجسدي والنفسي عبر أدوات التربية الإيجابية المعتمدة من CDC، ومنهج 'جولة الأمان' اليومي للوقاية من الحوادث، ومهارة المدح النوعي المحدد. يستند المسار إلى نظريات Erikson (Industry vs Inferiority) وVygotsky (ZPD) لتنمية الكفاءة الذاتية دون مقارنة، مع التركيز على الجانب العملي القابل للقياس.",
  "lesson_ids": [
    "lesson_4-6_development_positive_parenting_b01",
    "lesson_4-6_development_positive_parenting_b02",
    "lesson_4-6_development_positive_parenting_01",
    "lesson_4-6_development_positive_parenting_02"
  ],
  "estimated_days": 4,
  "pedagogical_framework": "zpd_scaffolded",
  "primary_reference": {
    "type": "مقال_تنموي",
    "info": "CDC, Positive Parenting Tips for Preschoolers (3-5 years)"
  },
  "prerequisites": [],
  "is_published": true,
  "version": "1.0.0",
  "created_at": "2026-06-08T19:00:00",
  "updated_at": "2026-06-13T00:00:00",
  "approved_by": null
}
